{
  "checkpoint_id": "ckp_01J00000000000000000000000",
  "runtime_run_id": "rtr_01J00000000000000000000000",
  "provider_revision_id": "apr_01J00000000000000000000000",
  "runtime_version": "2026.07",
  "event_sequence": 42,
  "content_reference": "artifact://art_runtime_checkpoint/ver_01",
  "digest": "sha256:b1b1b1b1b1b1b1b1b1b1b1b1b1b1b1b1b1b1b1b1b1b1b1b1b1b1b1b1b1b1b1b1",
  "size_bytes": 8192,
  "portability": "compatible_revision",
  "compatibility_profile": "deerflow-checkpoint-v1",
  "created_at": "2026-07-15T10:10:00Z"
}
